{
  "generatedAt": "2026-05-12T00:49:57Z",
  "capabilities": [
    "tdd_enforcement",
    "planning_depth",
    "research_flow",
    "subagent_orchestration",
    "parallelism_safety",
    "verification_gates",
    "rollback_guardrails",
    "telemetry_proactive"
  ],
  "rows": [
    {
      "competitorId": "gstack",
      "capability": "tdd_enforcement",
      "status": "present",
      "enforcementLevel": "prompt_only",
      "evidence": [
        {
          "file": "health/SKILL.md",
          "line": 1001,
          "snippet": "1. [HIGH]  Fix 2 failing tests (Tests: 9/10, weight 30%)",
          "kind": "code_ref",
          "lastValidated": "2026-05-11T19:25:00Z",
          "validationMethod": "auto-scan"
        },
        {
          "file": "land-and-deploy/SKILL.md",
          "line": 1283,
          "snippet": "If tests fail: **BLOCKER.** Cannot merge with failing tests.",
          "kind": "code_ref",
          "lastValidated": "2026-05-11T19:25:00Z",
          "validationMethod": "auto-scan"
        },
        {
          "file": "land-and-deploy/SKILL.md",
          "line": 1296,
          "snippet": "- Names of any failing tests",
          "kind": "code_ref",
          "lastValidated": "2026-05-11T19:25:00Z",
          "validationMethod": "auto-scan"
        }
      ]
    },
    {
      "competitorId": "gstack",
      "capability": "planning_depth",
      "status": "present",
      "enforcementLevel": "prompt_only",
      "evidence": [
        {
          "file": "autoplan/SKILL.md",
          "line": 579,
          "snippet": "- two-phase commit",
          "kind": "code_ref",
          "lastValidated": "2026-05-11T19:25:00Z",
          "validationMethod": "auto-scan"
        },
        {
          "file": "autoplan/SKILL.md",
          "line": 872,
          "snippet": "- **CEO phase:** P1 (completeness) + P2 (boil lakes) dominate.",
          "kind": "code_ref",
          "lastValidated": "2026-05-11T19:25:00Z",
          "validationMethod": "auto-scan"
        },
        {
          "file": "autoplan/SKILL.md",
          "line": 873,
          "snippet": "- **Eng phase:** P5 (explicit) + P3 (pragmatic) dominate.",
          "kind": "code_ref",
          "lastValidated": "2026-05-11T19:25:00Z",
          "validationMethod": "auto-scan"
        }
      ]
    },
    {
      "competitorId": "gstack",
      "capability": "research_flow",
      "status": "present",
      "enforcementLevel": "prompt_only",
      "evidence": [
        {
          "file": "autoplan/SKILL.md",
          "line": 193,
          "snippet": "> Let gstack proactively suggest skills, like /qa for \"does this work?\" or /investigate for bugs?",
          "kind": "code_ref",
          "lastValidated": "2026-05-11T19:25:00Z",
          "validationMethod": "auto-scan"
        },
        {
          "file": "autoplan/SKILL.md",
          "line": 234,
          "snippet": "- Bugs/errors → invoke /investigate",
          "kind": "code_ref",
          "lastValidated": "2026-05-11T19:25:00Z",
          "validationMethod": "auto-scan"
        },
        {
          "file": "autoplan/SKILL.md",
          "line": 682,
          "snippet": "- **`solo`** — You own everything. Investigate and offer to fix proactively.",
          "kind": "code_ref",
          "lastValidated": "2026-05-11T19:25:00Z",
          "validationMethod": "auto-scan"
        }
      ]
    },
    {
      "competitorId": "gstack",
      "capability": "subagent_orchestration",
      "status": "present",
      "enforcementLevel": "prompt_only",
      "evidence": [
        {
          "file": "autoplan/SKILL.md",
          "line": 1058,
          "snippet": "# with Claude subagent only (autoplan's existing degradation fallback).",
          "kind": "code_ref",
          "lastValidated": "2026-05-11T19:25:00Z",
          "validationMethod": "auto-scan"
        },
        {
          "file": "autoplan/SKILL.md",
          "line": 1061,
          "snippet": "echo \"[codex-unavailable: binary not found] — proceeding with Claude subagent only\"",
          "kind": "code_ref",
          "lastValidated": "2026-05-11T19:25:00Z",
          "validationMethod": "auto-scan"
        },
        {
          "file": "autoplan/SKILL.md",
          "line": 1065,
          "snippet": "echo \"[codex-unavailable: auth missing] — proceeding with Claude subagent only. Run \\`codex login\\` or set \\$CODEX_API_KEY to enable dual-voice review.\"",
          "kind": "code_ref",
          "lastValidated": "2026-05-11T19:25:00Z",
          "validationMethod": "auto-scan"
        }
      ]
    },
    {
      "competitorId": "gstack",
      "capability": "parallelism_safety",
      "status": "present",
      "enforcementLevel": "prompt_only",
      "evidence": [
        {
          "file": "autoplan/SKILL.md",
          "line": 356,
          "snippet": "# Per-worktree pin: post-spike redesign uses kubectl-style `.gbrain-source` in the",
          "kind": "code_ref",
          "lastValidated": "2026-05-11T19:25:00Z",
          "validationMethod": "auto-scan"
        },
        {
          "file": "autoplan/SKILL.md",
          "line": 357,
          "snippet": "# git toplevel to scope queries. Look for the pin in the worktree (not a global",
          "kind": "code_ref",
          "lastValidated": "2026-05-11T19:25:00Z",
          "validationMethod": "auto-scan"
        },
        {
          "file": "autoplan/SKILL.md",
          "line": 358,
          "snippet": "# state file) so that opening worktree B without a pin doesn't claim \"indexed\"",
          "kind": "code_ref",
          "lastValidated": "2026-05-11T19:25:00Z",
          "validationMethod": "auto-scan"
        }
      ]
    },
    {
      "competitorId": "gstack",
      "capability": "verification_gates",
      "status": "present",
      "enforcementLevel": "prompt_only",
      "evidence": [
        {
          "file": "autoplan/SKILL.md",
          "line": 440,
          "snippet": "Privacy stop-gate: if output shows `ARTIFACTS_SYNC: off`, `artifacts_sync_mode_prompted` is `false`, and gbrain is on PATH or `gbrain doctor --fast --json` works, ask once:",
          "kind": "code_ref",
          "lastValidated": "2026-05-11T19:25:00Z",
          "validationMethod": "auto-scan"
        },
        {
          "file": "autoplan/SKILL.md",
          "line": 702,
          "snippet": "- **BLOCKED** — cannot proceed; state blocker and what was tried.",
          "kind": "code_ref",
          "lastValidated": "2026-05-11T19:25:00Z",
          "validationMethod": "auto-scan"
        },
        {
          "file": "autoplan/SKILL.md",
          "line": 908,
          "snippet": "feasibility blocker (not a preference), the AskUserQuestion framing explicitly",
          "kind": "code_ref",
          "lastValidated": "2026-05-11T19:25:00Z",
          "validationMethod": "auto-scan"
        }
      ]
    },
    {
      "competitorId": "gstack",
      "capability": "rollback_guardrails",
      "status": "present",
      "enforcementLevel": "prompt_only",
      "evidence": [
        {
          "file": "autoplan/SKILL.md",
          "line": 137,
          "snippet": "> v1 prompts are simpler: first-use jargon glosses, outcome-framed questions, shorter prose. Keep default or restore terse?",
          "kind": "code_ref",
          "lastValidated": "2026-05-11T19:25:00Z",
          "validationMethod": "auto-scan"
        },
        {
          "file": "autoplan/SKILL.md",
          "line": 141,
          "snippet": "- B) Restore V0 prose — set `explain_level: terse`",
          "kind": "code_ref",
          "lastValidated": "2026-05-11T19:25:00Z",
          "validationMethod": "auto-scan"
        },
        {
          "file": "autoplan/SKILL.md",
          "line": 240,
          "snippet": "- Resume context → invoke /context-restore",
          "kind": "code_ref",
          "lastValidated": "2026-05-11T19:25:00Z",
          "validationMethod": "auto-scan"
        }
      ]
    },
    {
      "competitorId": "gstack",
      "capability": "telemetry_proactive",
      "status": "present",
      "enforcementLevel": "prompt_only",
      "evidence": [
        {
          "file": "autoplan/SKILL.md",
          "line": 55,
          "snippet": "_TEL=$(~/.claude/skills/gstack/bin/gstack-config get telemetry 2>/dev/null || true)",
          "kind": "code_ref",
          "lastValidated": "2026-05-11T19:25:00Z",
          "validationMethod": "auto-scan"
        },
        {
          "file": "autoplan/SKILL.md",
          "line": 56,
          "snippet": "_TEL_PROMPTED=$([ -f ~/.gstack/.telemetry-prompted ] && echo \"yes\" || echo \"no\")",
          "kind": "code_ref",
          "lastValidated": "2026-05-11T19:25:00Z",
          "validationMethod": "auto-scan"
        },
        {
          "file": "autoplan/SKILL.md",
          "line": 59,
          "snippet": "echo \"TELEMETRY: ${_TEL:-off}\"",
          "kind": "code_ref",
          "lastValidated": "2026-05-11T19:25:00Z",
          "validationMethod": "auto-scan"
        }
      ]
    },
    {
      "competitorId": "superpowers",
      "capability": "tdd_enforcement",
      "status": "present",
      "enforcementLevel": "prompt_only",
      "evidence": [
        {
          "file": "skills/dispatching-parallel-agents/SKILL.md",
          "line": 92,
          "snippet": "Fix the 3 failing tests in src/agents/agent-tool-abort.test.ts:",
          "kind": "code_ref",
          "lastValidated": "2026-05-11T19:25:00Z",
          "validationMethod": "auto-scan"
        },
        {
          "file": "skills/finishing-a-development-branch/SKILL.md",
          "line": 236,
          "snippet": "- Proceed with failing tests",
          "kind": "code_ref",
          "lastValidated": "2026-05-11T19:25:00Z",
          "validationMethod": "auto-scan"
        },
        {
          "file": "skills/subagent-driven-development/implementer-prompt.md",
          "line": 33,